{"$schema":"https://json-schema.org/draft/2020-12/schema","$id":"urn:vibemind:shared:contracts:source-evidence:v1","title":"SourceEvidenceV1","type":"object","additionalProperties":false,"required":["contract_version","evidence_id","request_id","plan_id","job_id","source_url","retrieved_at","content_hash","locator","passage","source_quality","verification_status","artifact_refs","evidence_refs"],"properties":{"contract_version":{"const":"v1"},"evidence_id":{"$ref":"#/$defs/evidenceId"},"request_id":{"$ref":"#/$defs/requestId"},"plan_id":{"$ref":"#/$defs/planId"},"job_id":{"$ref":"#/$defs/jobId"},"source_url":{"type":"string","format":"uri","pattern":"^https?://","maxLength":2048},"retrieved_at":{"type":"string","format":"date-time","pattern":"(?:Z|[+-][0-9]{2}:[0-9]{2})$"},"content_hash":{"type":"string","pattern":"^sha256:[0-9a-f]{64}$"},"locator":{"type":"string","minLength":1,"maxLength":1000},"passage":{"type":"string","minLength":1,"maxLength":12000},"source_quality":{"enum":["primary","secondary","academic","government","standards"]},"verification_status":{"enum":["unverified","verified","rejected"]},"artifact_refs":{"type":"array","minItems":1,"uniqueItems":true,"items":{"$ref":"#/$defs/artifactId"}},"evidence_refs":{"type":"array","minItems":1,"uniqueItems":true,"items":{"$ref":"#/$defs/evidenceId"}}},"$defs":{"evidenceId":{"type":"string","pattern":"^evidence_v1_[0-9A-HJKMNPQRSTVWXYZ]{26}$"},"requestId":{"type":"string","pattern":"^request_v1_[0-9A-HJKMNPQRSTVWXYZ]{26}$"},"planId":{"type":"string","pattern":"^plan_v1_[0-9A-HJKMNPQRSTVWXYZ]{26}$"},"jobId":{"type":"string","pattern":"^job_v1_[0-9A-HJKMNPQRSTVWXYZ]{26}$"},"artifactId":{"type":"string","pattern":"^artifact_v1_[0-9A-HJKMNPQRSTVWXYZ]{26}$"}}}
